unique_id|competitor_name|extraction_date|product_name|brand|brand_type|grammage_quantity|grammage_unit|producthierarchy_level1|producthierarchy_level2|producthierarchy_level3|producthierarchy_level4|producthierarchy_level5|regular_price|selling_price|price_was|promotion_price|promotion_valid_from|promotion_valid_upto|promotion_type|percentage_discount|promotion_description|price_per_unit|currency|breadcrumb|pdp_url|fat_%|variants|product_description|instructions|storage_instructions|country_of_origin|allergens|nutritional_score|organictype|file_name_1|image_url_1|file_name_2|image_url_2|file_name_3|image_url_3|file_name_4|image_url_4|file_name_5|image_url_5|file_name_6|image_url_6|upc|ingredients|servings_per_pack
32896|dirk|2025-03-27|Alpro Sojadrink banaan|Alpro||3|x|Home|Boodschappen|Zuivel & kaas|Lactosevrije zuivel|Alpro sojadrink banaan|2.39|2.39||||||||||Home>Boodschappen>Zuivel & kaas>Lactosevrije zuivel>Alpro sojadrink banaan|https://www.dirk.nl/boodschappen/zuivel-kaas/lactosevrije-zuivel/alpro%20sojadrink%20banaan/32896|||Sojadrink, banaan, met toegevoegde calcium en vitaminen.|Goed schudden voor gebruik.|Na openen 5 dagen houdbaar in de koelkast (max. 7°C).||Bevat Soja, Vrij van Melk(eiwit), Vrij van Gluten, Vrij van Lactose||Non-Organic|32896_1.PNG|https://d3r3h30p75xj6a.cloudfront.net/artikelen/199970_1_387661_638616667003774449.png||||||||||||INGREDI�NTEN: SOJABASIS (water, gepelde SOJABONEN (7,8%)), suiker, maltodextrine, bananensap uit concentraat (1,2%), aroma, calciumcarbonaat, stabilisatoren (johannesbroodpitmeel, gellangom), zeezout, zuurteregelaar (kaliumfosfaten), natuurlijk aroma, vitaminen (B2, B12, D2)|
39710|dirk|2025-03-27|Alpro Barista soja|Alpro||1|liter|Home|Boodschappen|Zuivel & kaas|Lactosevrije zuivel|Alpro barista soja|2.55|2.55||||||||||Home>Boodschappen>Zuivel & kaas>Lactosevrije zuivel>Alpro barista soja|https://www.dirk.nl/boodschappen/zuivel-kaas/lactosevrije-zuivel/alpro%20barista%20soja/39710|||Sojadrink met toegevoegde calcium en vitaminen.||Ten minste houdbaar tot: zie bovenkant. Na openen gekoeld bewaren tussen max. +1°C en +7°C en binnen 5 dagen gebruiken.||Vrij van Zuivelproducten, Vrij van Gluten, Vrij van Lactose, Bevat Soja||Non-Organic|39710_1.PNG|https://d3r3h30p75xj6a.cloudfront.net/artikelen/203097_1_394192_638646955187551461.png||||||||||||SOJABASIS (96%) (water, gepelde SOJABONEN (8,7%)), appelextract, zuurteregelaar (kaliumfosfaten), calcium (calciumcarbonaat), zeezout, stabilisator (gellangom), vitaminen B2, B12, D2|
44828|dirk|2025-03-27|Alpro Sojadrink choco|Alpro||3|x|Home|Boodschappen|Zuivel & kaas|Lactosevrije zuivel|Alpro sojadrink choco|2.45|2.45||||||||||Home>Boodschappen>Zuivel & kaas>Lactosevrije zuivel>Alpro sojadrink choco|https://www.dirk.nl/boodschappen/zuivel-kaas/lactosevrije-zuivel/alpro%20sojadrink%20choco/44828|||Sojadrink, chocoladesmaak, met toegevoegde calcium en vitaminen.|Geschikt om met levensmiddelen in contact te komen.|Na openen 5 dagen houdbaar in de koelkast (max. 7°C)||Bevat Soja, Vrij van Melk(eiwit), Vrij van Gluten, Vrij van Lactose||Non-Organic|44828_1.PNG|https://d3r3h30p75xj6a.cloudfront.net/artikelen/199972_1_397894_638616667958733090.png||||||||||||INGREDI�NTEN: SOJABASIS (water, gepelde SOJABONEN (7%)), suiker, magere cacao (1,5%), calciumcarbonaat, stabilisatoren (carrageen, guarpitmeel, xanthaangom), zuurteregelaar (kaliumfosfaten), aroma, zeezout, natuurlijk aroma, vitaminen (B2, D2). Vrij van zuivel en gluten. Van nature lactosevrij.|
50039|dirk|2025-03-27|Alpro Barista haver|Alpro||1|liter|Home|Boodschappen|Zuivel & kaas|Lactosevrije zuivel|Alpro barista haver|2.29|2.29||||||||||Home>Boodschappen>Zuivel & kaas>Lactosevrije zuivel>Alpro barista haver|https://www.dirk.nl/boodschappen/zuivel-kaas/lactosevrije-zuivel/alpro%20barista%20haver/50039|||Haverdrink met toegevoegde vitaminen.|Gebruiksinstructies voor baristas: Schuim op tot maximaal 65°C. Schuim nooit een tweede keer op. Goed schudden en koelen voor gebruik. Schuim op tot max. 65°C Warm, koud & cold brew Gebruiksinstructies voor de koffieliefhebbers thuis: 1. Gebruik mij gekoeld, dan werk ik het beste! 2. Schenk mij in je melkopschuimer of in een pan om te verwarmen. 3. Voor het mooiste schuim verwarm mij niet verder dan 65°C max. 4. Als je mij opwarmt in een pan, schuim mij dan op met een handmixertje tot ik dubbel zo groot ben. Tik vervolgens voorzichtig met de pan om de luchtbellen te laten ontsnappen. 5. Je fantastische schuim is klaar! Nu is het jouw kans om te schitteren en te pronken als een ware barista! Kan zowel warm als koud gebruikt worden.|Ten minste houdbaar tot: zie bovenkant. Na openen 5 dagen houdbaar in de koelkast (max. 7°C).||Bevat Gluten, Vrij van Melk(eiwit), Vrij van Lactose, Bevat Haver||Non-Organic|50039_1.PNG|https://d3r3h30p75xj6a.cloudfront.net/artikelen/203101_1_402285_638646954866643811.png||||||||||||INGREDI�NTEN: HAVERBASIS (water, HAVER (10%)), zonnebloemolie, chicoreivezel, erwteneiwit, zuurteregelaar (kaliumfosfaten), zeezout, vitaminen (B2, B12, D2). Vrij van zuivel.|
51502|dirk|2025-03-27|Melkan Houdbare lactosevrije halfvolle melk|Melkan||1|liter|Home|Boodschappen|Zuivel & kaas|Lactosevrije zuivel|Melkan houdbare lactosevrije halfvolle melk|1.25|1.25||||||||||Home>Boodschappen>Zuivel & kaas>Lactosevrije zuivel>Melkan houdbare lactosevrije halfvolle melk|https://www.dirk.nl/boodschappen/zuivel-kaas/lactosevrije-zuivel/melkan%20houdbare%20lactosevrije%20halfvolle%20melk/51502|||UHT Halfvolle melk, lactosevrij (<0,01 g/100 ml)||Dit product is ongeopend buiten de koeling houdbaar tot de aangegeven datum op de verpakking.||Bevat Melk(eiwit), Bevat Lactose||Non-Organic|51502_1.PNG|https://d3r3h30p75xj6a.cloudfront.net/artikelen/183921_1_403924_638448186444320688.png||||||||||||Ingrediënten :halfvolle MELK|
61941|dirk|2025-03-27|Bio+ Biologische haverdrink ongezoet plantaardig|Bio+||1|liter|Home|Boodschappen|Zuivel & kaas|Lactosevrije zuivel|Bio+ biologische haverdrink ongezoet plantaardig|1.39|1.39||||||||||Home>Boodschappen>Zuivel & kaas>Lactosevrije zuivel>Bio+ biologische haverdrink ongezoet plantaardig|https://www.dirk.nl/boodschappen/zuivel-kaas/lactosevrije-zuivel/bio%2b%20biologische%20haverdrink%20ongezoet%20plantaardig/61941|||Biologische haverdrink, UHT.|Schudden voor gebruik. Gebruiksaanwijzing: Schudden voor gebruik.|Lang houdbaar buiten de koeling, mits ongeopend. Na openen gekoeld bewaren (max. 7°C) en beperkt houdbaar.||Bevat Gluten, Bevat Haver||Organic|61941_1.PNG|https://d3r3h30p75xj6a.cloudfront.net/artikelen/179420_1_413201_638406498456598997.png||||||||||||Ingrediënten :Water, 12% HAVER*, zonnebloemolie*, zeezout. *van biologische oorsprong|
62601|dirk|2025-03-27|Oatly Haverdrank barista edition plantaardig|Oatly||1|liter|Home|Boodschappen|Zuivel & kaas|Lactosevrije zuivel|Oatly haverdrank barista edition plantaardig|2.75|2.75||||||||||Home>Boodschappen>Zuivel & kaas>Lactosevrije zuivel>Oatly haverdrank barista edition plantaardig|https://www.dirk.nl/boodschappen/zuivel-kaas/lactosevrije-zuivel/oatly%20haverdrank%20barista%20edition%20plantaardig/62601|||Schuimbare haverdrank met toegevoegde vitamines en mineralen.|Goed schudden.|Ten minste houdbaar tot: Zie bovenkant verppakking. Na openen 5 dagen houdbaar in de koelkast (+8 ° C).||Bevat Gluten, Vrij van Melk(eiwit), Vrij van Soja, Bevat Haver||Non-Organic|62601_1.PNG|https://d3r3h30p75xj6a.cloudfront.net/artikelen/59153_1_416241_637856410915786595.png||||||||||||Ingrediënten: Water, HAVER 10%, koolzaadolie, zuurteregelaar (dikaliumfosfaat), mineralen (calciumcarbonaat, kaliumjodide), zout, vitaminen (D2, riboflavine, B12)_x000D_|
63293|dirk|2025-03-27|Melkan Houdbare lactosevrije volle melk|Melkan||1|liter|Home|Boodschappen|Zuivel & kaas|Lactosevrije zuivel|Melkan houdbare lactosevrije volle melk|1.42|1.42||||||||||Home>Boodschappen>Zuivel & kaas>Lactosevrije zuivel>Melkan houdbare lactosevrije volle melk|https://www.dirk.nl/boodschappen/zuivel-kaas/lactosevrije-zuivel/melkan%20houdbare%20lactosevrije%20volle%20melk/63293|||UHT Volle melk, lactosevrij (<0,01 g/100 ml)||Dit product is ongeopend buiten de koeling houdbaar tot de aangegeven datum op de verpakking.||Bevat Melk(eiwit), Bevat Lactose||Non-Organic|63293_1.PNG|https://d3r3h30p75xj6a.cloudfront.net/artikelen/210856_1_416091_638719329840484294.png||||||||||||Ingrediënten :Volle MELK|
80243|dirk|2025-03-27|Friesche Vlag Haverdrank plantaardig|Friesche Vlag||1|liter|Home|Boodschappen|Zuivel & kaas|Lactosevrije zuivel|Friesche vlag haverdrank plantaardig|2.65|2.65||||||||||Home>Boodschappen>Zuivel & kaas>Lactosevrije zuivel>Friesche vlag haverdrank plantaardig|https://www.dirk.nl/boodschappen/zuivel-kaas/lactosevrije-zuivel/friesche%20vlag%20haverdrank%20plantaardig/80243|||Haverdrank UHT, met toegevoegd calcium en vitamine B2, B12 en D||Ongeopend: aanbevolen bewaartemperatuur tussen 4 - 24°C. Ongeopend te bewaren in een frisse, koele, propere en reukloze omgeving, beschermd tegen het zonlicht. Na openen beperkt houdbaar in de koelkast (max. 7°C). Ten minste houdbaar tot: zie bovenzijde.||Kan sporen bevatten van Amandelen, Kan sporen bevatten van Cashewnoten, Kan sporen bevatten van Hazelnoten, Bevat Haver, Kan sporen bevatten van Soja, Kan sporen bevatten van Walnoten||Non-Organic|80243_1.PNG|https://d3r3h30p75xj6a.cloudfront.net/artikelen/183753_1_439461_638446467259441346.png||||||||||||Water, 13% HAVER, raapzaadolie, calciumcarbonaat, zuurteregelaar: dikaliumfosfaat, zeezout, vitamine B2, B12 en D|
93101|dirk|2025-03-27|Oatly Haverdrink halfvol|Oatly||1|liter|Home|Boodschappen|Zuivel & kaas|Lactosevrije zuivel|Oatly haverdrink halfvol|2.49|2.49||||||||||Home>Boodschappen>Zuivel & kaas>Lactosevrije zuivel>Oatly haverdrink halfvol|https://www.dirk.nl/boodschappen/zuivel-kaas/lactosevrije-zuivel/oatly%20haverdrink%20halfvol/93101|||Houdbare Haverdrank Half Vol - 100% plantaardig|Goed schudden.|Ten minste houdbaar tot: Zie bovenkant verpakking. Na opening 5 dagen houdbaar in de koelkast (+8°C).||Bevat Gluten, Vrij van Melk(eiwit), Vrij van Soja, Bevat Haver||Non-Organic|93101_1.PNG|https://d3r3h30p75xj6a.cloudfront.net/artikelen/190530_1_449662_638513004524406934.png||||||||||||Ingrediënten: Haverbasis (water, HAVER 10%), koolzaadolie, dipotassiumfosfaat, mineralen (calciumcarbonaat, kaliumjodide), zout, vitaminen (D2, riboflavine en B12)|
99222|dirk|2025-03-27|Alpro Soja drink original|Alpro||750|ml|Home|Boodschappen|Zuivel & kaas|Lactosevrije zuivel|Alpro soja drink original|2.45|2.45||||||||||Home>Boodschappen>Zuivel & kaas>Lactosevrije zuivel>Alpro soja drink original|https://www.dirk.nl/boodschappen/zuivel-kaas/lactosevrije-zuivel/alpro%20soja%20drink%20original/99222|||Sojadrink met toegevoegde calcium en vitaminen.||Na openen 5 dagen houdbaar in de koelkast (max. 7°C).||Bevat Soja, Vrij van Melk(eiwit), Vrij van Gluten, Vrij van Lactose||Non-Organic|99222_1.PNG|https://d3r3h30p75xj6a.cloudfront.net/artikelen/198586_1_432478_638605284516428844.png||||||||||||INGREDIËNTEN: water, gepelde SOJABONEN (8%), suiker, calciumcarbonaat, zuurteregelaar (kaliumfosfaten), aroma, zeezout, stabilisator (gellangom), vitaminen (B2, B12, D2). Vrij van zuivel en gluten. Van nature lactosevrij.|
101059|dirk|2025-03-27|Melkan Sojadrink naturel gezoet|Melkan||1|liter|Home|Boodschappen|Zuivel & kaas|Lactosevrije zuivel|Melkan sojadrink naturel gezoet|0.78|0.78||||||||||Home>Boodschappen>Zuivel & kaas>Lactosevrije zuivel>Melkan sojadrink naturel gezoet|https://www.dirk.nl/boodschappen/zuivel-kaas/lactosevrije-zuivel/melkan%20sojadrink%20naturel%20gezoet/101059|||UHT sojadrink met toegevoegd suiker, calcium en vitamines B2, B12, D2|schudden voor gebruik Gebruiksaanwijzing: schudden voor gebruik. Vouw het pak zo klein mogelijk op 1. dop open draaien en vouwen maar 2. maak het pak zo klein mogelijk 3. dop erop draaien en bij de drankenkartons.|Na openen gekoeld bewaren (max. 7 °C) en beperkt houdbaar||Bevat Soja||Non-Organic|101059_1.PNG|https://d3r3h30p75xj6a.cloudfront.net/artikelen/211145_1_459657_638719332095333439.png||||||||||||Ingrediënten :Water, 9% gepelde SOJABONEN, suiker, tricalciumfosfaat, zeezout, aroma, stabilisator: E418, vitamines (vitamine B2, B12, D2).|
101060|dirk|2025-03-27|Melkan Kokos drink ongezoet|Melkan||1|liter|Home|Boodschappen|Zuivel & kaas|Lactosevrije zuivel|Melkan kokos drink ongezoet|1.89|1.89||||||||||Home>Boodschappen>Zuivel & kaas>Lactosevrije zuivel>Melkan kokos drink ongezoet|https://www.dirk.nl/boodschappen/zuivel-kaas/lactosevrije-zuivel/melkan%20kokos%20drink%20ongezoet/101060|||UHT kokosdrink met gefermenteerde rijst, toegevoegd calcium en vitamine B12 en D2|Schudden voor gebruik.|Lang houdbaar buiten de koeling, mits ongeopend. Na openen gekoeld bewaren (max. 7°C) en beperkt houdbaar.||||Non-Organic|101060_1.PNG|https://d3r3h30p75xj6a.cloudfront.net/artikelen/183485_1_459658_638442759108177380.png||||||||||||Ingrediënten :Water, 8% kokosmelk (kokoscrème, water), 4% rijst, verdikkingsmiddel: E412/E415/E418, zuurteregelaar: E340/E341, emulgator: E322, zout, vitamines (vitamine B12, D2), natuurlijk aroma. Dit product kan sporen van NOTEN en SOJA bevatten.|
101061|dirk|2025-03-27|Melkan Drink haver original|Melkan||1|liter|Home|Boodschappen|Zuivel & kaas|Lactosevrije zuivel|Melkan drink haver original|1.35|1.35||||||||||Home>Boodschappen>Zuivel & kaas>Lactosevrije zuivel>Melkan drink haver original|https://www.dirk.nl/boodschappen/zuivel-kaas/lactosevrije-zuivel/melkan%20drink%20haver%20original/101061|||UHT drink van gefermenteerde haver met toegevoegd calcium en vitamines B2, B12 en D2|Schudden voor gebruik. Gebruiksaanwijzing: schudden voor gebruik.|Lang houdbaar buiten de koeling, mits ongeopend. Na openen gekoeld bewaren (max. 7°C) en beperkt houdbaar.||Bevat Gluten, Bevat Haver||Non-Organic|101061_1.PNG|https://d3r3h30p75xj6a.cloudfront.net/artikelen/196480_1_459659_638580138798865001.png||||||||||||Ingrediënten :Water, 11% HAVER, raapzaadolie, calciumcarbonaat, zout, vitamines (vitamine B2, B12, D2). Dit product kan sporen van NOTEN en SOJA bevatten.|
101062|dirk|2025-03-27|Melkan Drink soja ongezoet|Melkan||1|liter|Home|Boodschappen|Zuivel & kaas|Lactosevrije zuivel|Melkan drink soja ongezoet|0.88|0.88||||||||||Home>Boodschappen>Zuivel & kaas>Lactosevrije zuivel>Melkan drink soja ongezoet|https://www.dirk.nl/boodschappen/zuivel-kaas/lactosevrije-zuivel/melkan%20drink%20soja%20ongezoet/101062|||UHT sojadrink met toegevoegd calcium en vitamines B2, B12, D2|Schudden voor gebruik. Gebruiksaanwijzing: schudden voor gebruik.|Lang houdbaar buiten de koeling, mits ongeopend. Na openen gekoeld bewaren (max. 7°C) en beperkt houdbaar.||Bevat Soja||Non-Organic|101062_1.PNG|https://d3r3h30p75xj6a.cloudfront.net/artikelen/196481_1_459660_638580138821235910.png||||||||||||Ingrediënten :water, 9% SOJABONEN, calciumcarbonaat, stabilisator: E418, zout, natuurlijke aroma, vitamines (vitamine B2, B12, D2). Dit product kan sporen van NOTEN bevatten.|
101063|dirk|2025-03-27|Melkan Drink amandel ongezoet|Melkan||1|liter|Home|Boodschappen|Zuivel & kaas|Lactosevrije zuivel|Melkan drink amandel ongezoet|1.34|1.34||||||||||Home>Boodschappen>Zuivel & kaas>Lactosevrije zuivel>Melkan drink amandel ongezoet|https://www.dirk.nl/boodschappen/zuivel-kaas/lactosevrije-zuivel/melkan%20drink%20amandel%20ongezoet/101063|||UHT amandeldrink met toegevoegd calcium en vitamines B2, B12 en D2.|Schudden voor gebruik. Na openen gekoeld bewaren. Gebruiksaanwijzing: schudden voor gebruik.|Lang houdbaar buiten de koeling, mits ongeopend. Na openen gekoeld bewaren (max. 7°C) en beperkt houdbaar.||Bevat Noten, Bevat Amandelen, Kan sporen bevatten van Hazelnoten||Non-Organic|101063_1.PNG|https://d3r3h30p75xj6a.cloudfront.net/artikelen/179472_1_459661_638406498384599871.png||||||||||||Ingrediënten :water, 2% AMANDEL, calciumcarbonaat, verdikkingsmiddel: gellangom/guargom, emulgator: lecithine, zout, vitamines (vitamine B2, B12, D2). Dit product kan sporen van andere NOTEN bevatten.|
112444|dirk|2025-03-27|Melkan Haver barista|Melkan||1|liter|Home|Boodschappen|Zuivel & kaas|Lactosevrije zuivel|Melkan haver barista|1.49|1.49||||||||||Home>Boodschappen>Zuivel & kaas>Lactosevrije zuivel>Melkan haver barista|https://www.dirk.nl/boodschappen/zuivel-kaas/lactosevrije-zuivel/melkan%20haver%20barista/112444|||UHT haverdrank, met toegevoegde vitamines en mineralen.|Voor gebruik goed schudden. Suggestie: voor het perfecte schuim raden we aan de haverdrank te koelen voor gebruik. Schuim het op tot maximaal 60°C tot het gewenste schuim is bereikt.|Lang houdbaar buiten de koeling, mits ongeopend. Na openen gekoeld bewaren (max. 7°C) en beperkt houdbaar.||Bevat Gluten, Bevat Haver||Non-Organic|112444_1.PNG|https://d3r3h30p75xj6a.cloudfront.net/artikelen/219572_1_471023_638769434598063461.png||||||||||||Ingrediënten :water, 10% HAVER, raapzaadolie, zuurteregelaar: E340, calciumcarbonaat, zeezout, stabilisator: E418, vitamines (B2, B12, D2).|
115409|dirk|2025-03-27|OATLY Haver barista light|OATLY||1|liter|Home|Boodschappen|Zuivel & kaas|Lactosevrije zuivel|Oatly haver barista light|2.75|2.75||||||||||Home>Boodschappen>Zuivel & kaas>Lactosevrije zuivel>Oatly haver barista light|https://www.dirk.nl/boodschappen/zuivel-kaas/lactosevrije-zuivel/oatly%20haver%20barista%20light/115409|||Schuimbare haverdrank met toegevoegde vitamines en mineralen. Light.||Ten minste houdbaar tot: Zie bovenkant verpakking. Na openen 5 dagen houdbaar in de koelkast (+8°C).||Vrij van Melk(eiwit), Bevat Haver, Vrij van Soja||Non-Organic|115409_1.PNG|https://d3r3h30p75xj6a.cloudfront.net/artikelen/216930_1_476795_638781555540747569.png||||||||||||Water, HAVER 10%, koolzaadolie, zuurteregelaar (dikaliumfosfaat), mineralen (calciumcarbonaat, kaliumjodide), zout, vitaminen (D2, riboflavine, B12)|
3115|dirk|2025-03-27|Alpro Fresh original|Alpro||1|liter|Home|Boodschappen|Zuivel & kaas|Lactosevrije zuivel|Alpro fresh original|2.55|2.55||||||||||Home>Boodschappen>Zuivel & kaas>Lactosevrije zuivel>Alpro fresh original|https://www.dirk.nl/boodschappen/zuivel-kaas/lactosevrije-zuivel/alpro%20fresh%20original/3115|||Sojadrink met toegevoegde calcium en vitaminen.|Kan zowel warm als koud gebruikt worden. Als ontbijt , in recepten. Lekker in koffie & thee, of zo uit het glas...|Koel bewaren bij max. 7°C. Na openen 5 dagen houdbaar.||Vrij van Melk(eiwit), Vrij van Gluten, Vrij van Lactose, Bevat Soja||Non-Organic|3115_1.PNG|https://d3r3h30p75xj6a.cloudfront.net/artikelen/191370_1_226305_638524848497517314.png||||||||||||INGREDIËNTEN: SOJABASIS (water, gepelde SOJABONEN (8%)), suiker, zuurteregelaars (kaliumfosfaten), calciumcarbonaat, aroma, zeezout, stabilisator (gellangom), vitaminen (B2, B12, D2). Vrij van zuivel en gluten.|
14795|dirk|2025-03-27|Alpro Amandeldrink zonder suiker|Alpro||1|liter|Home|Boodschappen|Zuivel & kaas|Lactosevrije zuivel|Alpro amandeldrink zonder suiker|2.79|2.79||||||||||Home>Boodschappen>Zuivel & kaas>Lactosevrije zuivel>Alpro amandeldrink zonder suiker|https://www.dirk.nl/boodschappen/zuivel-kaas/lactosevrije-zuivel/alpro%20amandeldrink%20zonder%20suiker/14795|||Amandeldrink met toegevoegde calcium & vit.||Koel bewaren bij max. 7°C. Na openen 5 dagen houdbaar.||Bevat Noten, Vrij van Melk(eiwit), Vrij van Gluten, Vrij van Pinda's, Vrij van Lactose||Non-Organic|14795_1.PNG|https://d3r3h30p75xj6a.cloudfront.net/artikelen/41644_1_374768_637970140428677802.png||||||||||||INGREDIËNTEN: water, AMANDEL (2,3%), tricalciumfosfaat, zeezout, stabilisatoren (johannesbroodpitmeel, gellan gom), emulgator (zonnebloemlecithine),vitaminen (riboflavine (B2), B12, E, D2). Kan sporen van noten (geen pindanoten) bevatten. Vrij van zuivel en gluten.|
64142|dirk|2025-03-27|Oatly Verse volle haverdrank|Oatly||1|liter|Home|Boodschappen|Zuivel & kaas|Lactosevrije zuivel|Oatly verse volle haverdrank|2.45|2.45||||||||||Home>Boodschappen>Zuivel & kaas>Lactosevrije zuivel>Oatly verse volle haverdrank|https://www.dirk.nl/boodschappen/zuivel-kaas/lactosevrije-zuivel/oatly%20verse%20volle%20haverdrank/64142|||Haverdrank met toegevoegde vitamines en mineralen, 2,8% vet.|Shake me!|Ten minste houdbaar tot:_x000D_ Zie bovenkant verpakking._x000D_ Na openen binnen 5 dagen consumeren._x000D_ Gekoeld bewaren, max +8°C.||Bevat Gluten, Vrij van Melk(eiwit), Vrij van Soja, Bevat Haver||Non-Organic|64142_1.PNG|https://d3r3h30p75xj6a.cloudfront.net/artikelen/216987_1_415013_638750541279087741.png||||||||||||Ingrediënten: Water, HAVER 10%, koolzaadolie, zuurteregelaar (dikaliumfosfaat), mineralen (calciumcarbonaat, kaliumjodide), zout, vitaminen (D2, riboflavine, B12)_x000D_|
65370|dirk|2025-03-27|Oatly Verse halfvolle haverdrank|Oatly||1|liter|Home|Boodschappen|Zuivel & kaas|Lactosevrije zuivel|Oatly verse halfvolle haverdrank|2.49|2.49||||||||||Home>Boodschappen>Zuivel & kaas>Lactosevrije zuivel>Oatly verse halfvolle haverdrank|https://www.dirk.nl/boodschappen/zuivel-kaas/lactosevrije-zuivel/oatly%20verse%20halfvolle%20haverdrank/65370|||Haverdrank met toegevoegde vitamines en mineralen, 1,5% vet.|Shake me!|Ten minste houdbaar tot: Zie bovenkant verpakking. Na openen binnen 5 dagen consumeren._x000D_ Gekoeld bewaren, max +8°C.||Bevat Gluten, Vrij van Melk(eiwit), Vrij van Soja, Bevat Haver||Non-Organic|65370_1.PNG|https://d3r3h30p75xj6a.cloudfront.net/artikelen/100574_1_416706_637856410983908210.png||||||||||||Ingrediënten: Water, HAVER 10%, koolzaadolie, zuurteregelaar (dikaliumfosfaat), mineralen (calciumcarbonaat, kaliumjodide), zout, vitaminen (D2, riboflavine, B12)_x000D_|
8779|dirk|2025-03-27|Alpro Groeidrink soja 1-3 jaar|Alpro||1|liter|Home|Boodschappen|Zuivel & kaas|Lactosevrije zuivel|Alpro groeidrink soja 1 3 jaar|2.49|2.49||||||||||Home>Boodschappen>Zuivel & kaas>Lactosevrije zuivel>Alpro groeidrink soja 1 3 jaar|https://www.dirk.nl/boodschappen/zuivel-kaas/lactosevrije-zuivel/alpro%20groeidrink%20soja%201-3%20jaar/8779|||Sojadrink voor kinderen vanaf 1 jaar met toegevoegde mineralen en vitaminen.|Geschikt voor zowel warm als koud gebruik en voor de bereiding van graan- en fruitpap.|Na openen 5 dagen houdbaar in de koelkast (max. 7°C). Niet invriezen!||Bevat Soja, Vrij van Melk(eiwit), Vrij van Gluten||Non-Organic|8779_1.PNG|https://d3r3h30p75xj6a.cloudfront.net/artikelen/198565_1_358556_638604363422790832.png||||||||||||INGREDIËNTEN: water, maltodextrine, gepelde SOJABONEN (4,9%), ruwe rietsuiker, fructose, plantaardige olie (zonnebloem), calciumcarbonaat, zuurteregelaar (monokaliumfosfaat), aroma's, vitaminen (C, riboflavine (B2), B12, D2), emulgator (zonnebloemlecithine), stabilisator (gellan gom), ijzerpyrofosfaat, kaliumjodide. Vrij van zuivel en gluten.|
6700|dirk|2025-03-27|Betsies Volle geitenmelk|Betsies||750|ml|Home|Boodschappen|Zuivel & kaas|Melk & karnemelk|Betsies volle geitenmelk|1.79|1.79||||||||||Home>Boodschappen>Zuivel & kaas>Melk & karnemelk>Betsies volle geitenmelk|https://www.dirk.nl/boodschappen/zuivel-kaas/melk-karnemelk/betsies%20volle%20geitenmelk/6700|||Gepasteuriseerde geitenmelk met natuurlijk vetgehalte|Koel bewaren (max 7 graden) Na openen beperkt houdbaar|||Bevat Melk(eiwit), Bevat Lactose||Non-Organic|6700_1.PNG|https://d3r3h30p75xj6a.cloudfront.net/artikelen/178084_1_348072_638392737967408770.png||||||||||||Ingrediënten: hoog gepasteuriseerde GEITENMELK|
6247|dirk|2025-03-27|Melkunie Halfvolle melk|Melkunie||500|ml|Home|Boodschappen|Zuivel & kaas|Melk & karnemelk|Melkunie halfvolle melk|0.98|0.98||||||||||Home>Boodschappen>Zuivel & kaas>Melk & karnemelk>Melkunie halfvolle melk|https://www.dirk.nl/boodschappen/zuivel-kaas/melk-karnemelk/melkunie%20halfvolle%20melk/6247|||Halfvolle Melk, Gepasteuriseerd||Na openen 7 dagen fris en vers Ten minste houdbaar tot: zie datum bovenzijde Gekoeld bewaren (max. 7�\x84\x83) Voorkom verspilling. Deze milk is nog vaak goed na datum: kijk, ruik, proef.||Bevat Lactose, Bevat Melk(eiwit)||Non-Organic|6247_1.PNG|https://d3r3h30p75xj6a.cloudfront.net/artikelen/219078_1_343916_638767011205674871.png|||||||||||||
6248|dirk|2025-03-27|Melkunie Halfvolle melk drank extra calcium|Melkunie||1|liter|Home|Boodschappen|Zuivel & kaas|Melk & karnemelk|Melkunie halfvolle melk drank extra calcium|1.45|1.45||||||||||Home>Boodschappen>Zuivel & kaas>Melk & karnemelk>Melkunie halfvolle melk drank extra calcium|https://www.dirk.nl/boodschappen/zuivel-kaas/melk-karnemelk/melkunie%20halfvolle%20melk%20drank%20extra%20calcium/6248|||Halfvolle melk met extra calcium, hooggepasteuriseerd|Serveer tip* *Wij geven je graag wat inspiratie voor een lekkere boterham, die perfect past bij jouw glaasje halfvolle melk! Besmeer drie getoaste witte boterhammen met roomkaas en beleg deze met plakjes gerookte zalm. Maak er een stapel van en snijd het éénmaal doormidden.|Ten minste houdbaar tot: zie datum bovenzijde. Gekoeld bewaren (max. 7°C).||Bevat Melk(eiwit)||Non-Organic|6248_1.PNG|https://d3r3h30p75xj6a.cloudfront.net/artikelen/219079_1_343918_638767002422646979.png||||||||||||Ingrediënten: HALFVOLLE MELK, calcium, stabilisator: carrageen|
6277|dirk|2025-03-27|Melkunie Halfvolle melk|Melkunie||||Home|Boodschappen|Zuivel & kaas|Melk & karnemelk|Melkunie halfvolle melk|1.89|1.89||||||||||Home>Boodschappen>Zuivel & kaas>Melk & karnemelk>Melkunie halfvolle melk|https://www.dirk.nl/boodschappen/zuivel-kaas/melk-karnemelk/melkunie%20halfvolle%20melk/6277|||HALFVOLLE MELK, GEPASTEURISEERD||Na opening blijft deze Melkunie melk 7 dagen fris en vers�\x81�¹�\x81�. �\x81�¹�\x81�Let wel op de houdbaarheidsdatum op de verpakking. Ten minste houdbaar tot: zie datum bovenzijde. Gekoeld bewaren (max. 7°C).||Bevat Melk(eiwit)||Non-Organic|6277_1.PNG|https://d3r3h30p75xj6a.cloudfront.net/artikelen/219082_1_344057_638767011471652700.png||||||||||||Ingrediënten: Bevat koemelkeiwit en lactose.|
