unique_id|competitor_name|extraction_date|product_name|brand|brand_type|grammage_quantity|grammage_unit|producthierarchy_level1|producthierarchy_level2|producthierarchy_level3|producthierarchy_level4|producthierarchy_level5|regular_price|selling_price|price_was|promotion_price|promotion_valid_from|promotion_valid_upto|promotion_type|percentage_discount|promotion_description|price_per_unit|currency|breadcrumb|pdp_url|fat_%|variants|product_description|instructions|storage_instructions|country_of_origin|allergens|nutritional_score|organictype|file_name_1|image_url_1|file_name_2|image_url_2|file_name_3|image_url_3|file_name_4|image_url_4|file_name_5|image_url_5|file_name_6|image_url_6|upc|ingredients|servings_per_pack
78164|dirk|2025-03-27|Alpro Mild & creamy no sugars|Alpro||755|g|Home|Boodschappen|Zuivel & kaas|Yoghurt, kwark & pap|Alpro mild & creamy no sugars|2.85|2.85||||||||||Home>Boodschappen>Zuivel & kaas>Yoghurt, kwark & pap>Alpro mild & creamy no sugars|https://www.dirk.nl/boodschappen/zuivel-kaas/yoghurt-kwark-pap/alpro%20mild%20%26%20creamy%20no%20sugars/78164|||Gefermenteerd sojaproduct met toegevoegde calcium en vitaminen.|Goed schudden voor gebruik.|Koel bewaren bij max. 7°C. Na openen 5 dagen houdbaar.||Bevat Soja, Vrij van Gluten, Vrij van Melk(eiwit), Kan sporen bevatten van Noten, Vrij van Lactose, Vrij van Pinda's||Non-Organic|78164_1.PNG|https://d3r3h30p75xj6a.cloudfront.net/artikelen/191383_1_436275_638524869954474604.png||||||||||||Ingrediënten: SOJABASIS [water, gepelde SOJABONEN [10,7%]], tricalciumcitraat, zuurteregelaars [natriumcitraten, citroenzuur], stabilisator [pectinen], natuurlijk aroma, zeezout, antioxidanten [tocoferolrijk extract, vetzuuresters van ascorbinezuur], vitaminen [B12, D2], yoghurtculturen / -fermenten [S. thermophilus, L. bulgaricus]. Kan sporen van noten (geen pindanoten) bevatten. Vrij van zuivel en gluten. Van nature lactosevrij.|
79279|dirk|2025-03-27|Melkunie Breaker stracciatella|Melkunie||200|g|Home|Boodschappen|Zuivel & kaas|Yoghurt, kwark & pap|Melkunie breaker stracciatella|1.59|1.59||||||||||Home>Boodschappen>Zuivel & kaas>Yoghurt, kwark & pap>Melkunie breaker stracciatella|https://www.dirk.nl/boodschappen/zuivel-kaas/yoghurt-kwark-pap/melkunie%20breaker%20stracciatella/79279|||Yoghurt met chocoladestukjes||Gekoeld bewaren (max 7�\x84\x83) Ten minste houdbaar tot:||Bevat Melk(eiwit)||Non-Organic|79279_1.PNG|https://d3r3h30p75xj6a.cloudfront.net/artikelen/211781_1_439125_638721102483020334.png||||||||||||Ingredienten: YOGHURT, suiker, water, 1,3% chocoladestukjes (cacaomassa*, cacaoboter*, suiker, emulgator: zonnebloemlecithine), gemodificeerd maïszetmeel, aroma, verdikkingsmiddel: pectine en xanthaangom, lactase.|
79507|dirk|2025-03-27|Danoontje Plantaardig Tussendoortje Knijpyoghurt Amandel, Mango & Perzik|Danoontje||90|g|Home|Boodschappen|Zuivel & kaas|Yoghurt, kwark & pap|Danoontje plantaardig tussendoortje knijpyoghurt amandel, mango & perzik|1.05|1.05||||||||||Home>Boodschappen>Zuivel & kaas>Yoghurt, kwark & pap>Danoontje plantaardig tussendoortje knijpyoghurt amandel, mango & perzik|https://www.dirk.nl/boodschappen/zuivel-kaas/yoghurt-kwark-pap/danoontje%20plantaardig%20tussendoortje%20knijpyoghurt%20amandel%2c%20mango%20%26%20perzik/79507|||Gefermenteerd amandelproduct met mango en perzik. Danoontje 100% Plantaardig. Een plantaardige variatie op knijpyoghurt op basis van amandel met de smaken mango en perzik. Heerlijk als tussendoortje, toetje of traktatie!<br><br>Het knijpzakje is tot 6 uur buiten de koelkast houdbaar en makkelijk mee te nemen naar school, de speeltuin, onderweg of bij een dagje uit.||Ten minste houdbaar tot:||Bevat Amandelen, Bevat Noten||Non-Organic|79507_1.PNG|https://d3r3h30p75xj6a.cloudfront.net/artikelen/118299_1_439305_638306013538568771.png||||||||||||AMANDELbasis (40%) (water, AMANDEL (9%), zetmeel, gellangom, fermenten), mangopuree (31%), perzikpuree (23%), suiker, verdikkingsmiddelen (rijstzetmeel, pectine), inuline, calciumcitraat, vitamines (D, B12), zuurteregelaar (melkzuur)|
80110|dirk|2025-03-27|HiPRO Protein Kwark Bosvruchten|HiPRO||200|g|Home|Boodschappen|Zuivel & kaas|Yoghurt, kwark & pap|Hipro protein kwark bosvruchten|1.89|1.89||||||||||Home>Boodschappen>Zuivel & kaas>Yoghurt, kwark & pap>Hipro protein kwark bosvruchten|https://www.dirk.nl/boodschappen/zuivel-kaas/yoghurt-kwark-pap/hipro%20protein%20kwark%20bosvruchten/80110|||ZUIVELPRODUCT MET KWARK EN BOSVRUCHTEN, ZOETSTOFFEN, 0% VET HiPRO Proteïne Kwark Bosvruchten is een heerlijk eiwitrijke kwark van Danone. Deze frisse kwark in de smaak banaan is ideaal voor onderweg, als tussendoortje of na het sporten.||Ten minste houdbaar tot: Bewaren bij +6°C max.||Bevat Melk(eiwit), Kan sporen bevatten van Soja||Non-Organic|80110_1.PNG|https://d3r3h30p75xj6a.cloudfront.net/artikelen/219972_1_439304_638773923396811432.png||||||||||||Ingrediënten: Magere verse kwark (50,6%) (MELK), yoghurt (MELK), bosvruchten (6,1%), (braambes (2,9%), aardbei (1,4%), blauwe bes (0,8%), zwarte bes (0,4%), rode bosbes (0,4%), framboos (0,2%)), MELKeiwit, verdikkingsmiddelen (tapiocazetmeel, pectine), kleurstof (wortel- en blauwe besconcentraat), geconcentreerd citroensap, natuurlijk aroma, zoetstoffen (acesulfaam-K, sucralose) Kan bevatten: Soja|
80131|dirk|2025-03-27|HiPRO Protein Kwark Banaan|HiPRO||200|g|Home|Boodschappen|Zuivel & kaas|Yoghurt, kwark & pap|Hipro protein kwark banaan|1.91|1.91||||||||||Home>Boodschappen>Zuivel & kaas>Yoghurt, kwark & pap>Hipro protein kwark banaan|https://www.dirk.nl/boodschappen/zuivel-kaas/yoghurt-kwark-pap/hipro%20protein%20kwark%20banaan/80131|||ZUIVELPRODUCT MET KWARK EN BANAAN, ZOETSTOFFEN, 0% VET HiPRO Proteïne Kwark Banaan is een heerlijk eiwitrijke kwark van Danone. Deze frisse kwark in de smaak banaan is ideaal voor onderweg, als tussendoortje of na het sporten.||Ten minste houdbaar tot: Bewaren bij +6°C max.||Bevat Melk(eiwit), Kan sporen bevatten van Soja||Non-Organic|80131_1.PNG|https://d3r3h30p75xj6a.cloudfront.net/artikelen/219971_1_439303_638773923376811502.png||||||||||||Ingrediënten: Magere verse kwark (50,6%) (MELK), yoghurt (MELK), banaan (5%), MELKeiwit, verdikkingsmiddelen (gemodificeerd maïszetmeel, pectine), kleurstof (karamel), geconcentreerd citroensap, aroma, zoetstoffen (acesulfaam-K, sucralose) Kan bevatten: soja|
83361|dirk|2025-03-27|Alpro Yoghurtvariatie kersen|Alpro||500|g|Home|Boodschappen|Zuivel & kaas|Yoghurt, kwark & pap|Alpro yoghurtvariatie kersen|2.55|2.55||||||||||Home>Boodschappen>Zuivel & kaas>Yoghurt, kwark & pap>Alpro yoghurtvariatie kersen|https://www.dirk.nl/boodschappen/zuivel-kaas/yoghurt-kwark-pap/alpro%20yoghurtvariatie%20kersen/83361|||Gefermenteerd sojaproduct, kers, met toegevoegde calcium en vitaminen.||koel bewaren bij max 7°C. Na openen 5 dagen houdbaar||Bevat Soja, Kan sporen bevatten van Noten, Vrij van Melk(eiwit), Vrij van Gluten, Vrij van Pinda's, Vrij van Lactose||Non-Organic|83361_1.PNG|https://d3r3h30p75xj6a.cloudfront.net/artikelen/220355_1_442953_638775570545770824.png||||||||||||Ingrediënten: SOJABASIS (water, gepelde SOJABONEN (9,7%)), kers (10,9%) (fruit (6,3%), sap uit concentraat (4,6%)), suiker, glucose-fructosestroop, tricalciumcitraat, stabilisator (pectinen), zuurteregelaars (natriumcitraten, citroenzuur), kleurstof (anthocyaninen), wortelextract, gemodificeerd zetmeel, aroma, zeezout, antioxidanten (tocoferolrijk extract, vetzuuresters van ascorbinezuur), vitaminen (B2, B12, D2), yoghurtculturen/ -fermenten (S. thermophilus, L. bulgaricus) Kan sporen van noten (geen pindanoten) bevatten. Vrij van zuivel en gluten. Van nature lactosevrij.|
87356|dirk|2025-03-27|Zuivelhoeve Boern yoghurt aardbei|Zuivelhoeve||750|g|Home|Boodschappen|Zuivel & kaas|Yoghurt, kwark & pap|Zuivelhoeve boern yoghurt aardbei|2.89|2.89||||||||||Home>Boodschappen>Zuivel & kaas>Yoghurt, kwark & pap>Zuivelhoeve boern yoghurt aardbei|https://www.dirk.nl/boodschappen/zuivel-kaas/yoghurt-kwark-pap/zuivelhoeve%20boern%20yoghurt%20aardbei/87356|||Yoghurt met aardbei.||Gekoeld bewaren (max. 7°C). Na openen beperkt houdbaar.||Bevat Melk(eiwit)||Non-Organic|87356_1.PNG|https://d3r3h30p75xj6a.cloudfront.net/artikelen/151356_1_448593_638126847105093330.png|87356_2.PNG|https://d3r3h30p75xj6a.cloudfront.net/artikelen/149898_1_448593_638126847112217061.png||||||||||Ingrediënten: YOGHURT, suiker, 6% aardbei, MELKEIWIT, 2% aardbeiensap, rijstzetmeel, zwartewortelextract, natuurlijk aroma, citroensapconcentraat, verdikkingsmiddelen (guarpitmeel, pectinen).|
87357|dirk|2025-03-27|Zuivelhoeve Boern yoghurt bosvruchten|Zuivelhoeve||750|g|Home|Boodschappen|Zuivel & kaas|Yoghurt, kwark & pap|Zuivelhoeve boern yoghurt bosvruchten|2.88|2.88||||||||||Home>Boodschappen>Zuivel & kaas>Yoghurt, kwark & pap>Zuivelhoeve boern yoghurt bosvruchten|https://www.dirk.nl/boodschappen/zuivel-kaas/yoghurt-kwark-pap/zuivelhoeve%20boern%20yoghurt%20bosvruchten/87357|||Yoghurt met bosvruchten.||Gekoeld bewaren (max. 7°C). Na openen beperkt houdbaar.||Bevat Melk(eiwit)||Non-Organic|87357_1.PNG|https://d3r3h30p75xj6a.cloudfront.net/artikelen/151357_1_448594_638126847118756009.png|87357_2.PNG|https://d3r3h30p75xj6a.cloudfront.net/artikelen/149899_1_448594_638126847124863968.png||||||||||Ingrediënten: YOGHURT, 6% bosvruchten (aardbei, braam, rode bessensap, bosbes), suiker, MELKEIWIT, maïszetmeel, verdikkingsmiddelen (guarpitmeel, pectinen), natuurlijk aroma, citroensapconcentraat, druivenconcentraat.|
87362|dirk|2025-03-27|Zuivelhoeve Boern yoghurt muesli naturel|Zuivelhoeve||170|g|Home|Boodschappen|Zuivel & kaas|Yoghurt, kwark & pap|Zuivelhoeve boern yoghurt muesli naturel|1.74|1.74||||||||||Home>Boodschappen>Zuivel & kaas>Yoghurt, kwark & pap>Zuivelhoeve boern yoghurt muesli naturel|https://www.dirk.nl/boodschappen/zuivel-kaas/yoghurt-kwark-pap/zuivelhoeve%20boern%20yoghurt%20muesli%20naturel/87362|||Yoghurt met muesli.||Gekoeld bewaren (max. 7Â°C). Na openen beperkt houdbaar.||Bevat Melk(eiwit), Bevat Gluten, Bevat Noten, Bevat Hazelnoten, Bevat Gerst, Bevat Tarwe, Bevat Haver||Non-Organic|87362_1.PNG|https://d3r3h30p75xj6a.cloudfront.net/artikelen/151364_1_448601_638306014110072711.png||||||||||||IngrediÃ«nten: YOGHURT, 10% muesli [HAVERVLOKKEN, suiker, zonnebloemolie, glucose-fructosestroop, TARWEVLOKKEN, kokos, HAZELNOOT, rijstebloem, TARWEMOUT, TARWEMEEL, TARWEGLUTEN, dextrose, invertsuiker, zout, GERSTEMOUT, melasse, antioxidant (tocoferolrijk extract)], MELKEIWIT.|
87363|dirk|2025-03-27|Zuivelhoeve Boern yoghurt muesli vanille|Zuivelhoeve||170|g|Home|Boodschappen|Zuivel & kaas|Yoghurt, kwark & pap|Zuivelhoeve boern yoghurt muesli vanille|1.74|1.74||||||||||Home>Boodschappen>Zuivel & kaas>Yoghurt, kwark & pap>Zuivelhoeve boern yoghurt muesli vanille|https://www.dirk.nl/boodschappen/zuivel-kaas/yoghurt-kwark-pap/zuivelhoeve%20boern%20yoghurt%20muesli%20vanille/87363|||Vanilleyoghurt met muesli.||Gekoeld bewaren (max. 7Â°C). Na openen beperkt houdbaar.||Bevat Melk(eiwit), Bevat Gluten, Bevat Noten, Bevat Tarwe, Bevat Gerst, Bevat Hazelnoten, Bevat Haver||Non-Organic|87363_1.PNG|https://d3r3h30p75xj6a.cloudfront.net/artikelen/151365_1_448602_638306014119815362.png||||||||||||IngrediÃ«nten: YOGHURT, 10% muesli [HAVERVLOKKEN, suiker, zonnebloemolie, glucose-fructsosestroop, TARWEVLOKKEN, kokos, HAZELNOOT, rijstebloem, TARWEMOUT, TARWEMEEL, TARWEGLUTEN, dextrose, invertsuiker, zout, GERSTEMOUT, melasse, antioxidant (tocoferolrijk extract)], suiker, MELKEIWIT, maÃ¯szetmeel, natuurlijk vanille-aroma, natuurlijk aroma, verdikkingsmiddelen (pectinen, guarpitmeel), kleurstof (carotenen).|
87364|dirk|2025-03-27|Zuivelhoeve Boern yoghurt muesli aardbei|Zuivelhoeve||170|g|Home|Boodschappen|Zuivel & kaas|Yoghurt, kwark & pap|Zuivelhoeve boern yoghurt muesli aardbei|1.74|1.74||||||||||Home>Boodschappen>Zuivel & kaas>Yoghurt, kwark & pap>Zuivelhoeve boern yoghurt muesli aardbei|https://www.dirk.nl/boodschappen/zuivel-kaas/yoghurt-kwark-pap/zuivelhoeve%20boern%20yoghurt%20muesli%20aardbei/87364|||Yoghurt met muesli en aardbei.||Gekoeld bewaren (max. 7Â°C). Na openen beperkt houdbaar.||Bevat Melk(eiwit), Bevat Gluten, Bevat Noten, Bevat Hazelnoten, Bevat Tarwe, Bevat Gerst, Bevat Haver||Non-Organic|87364_1.PNG|https://d3r3h30p75xj6a.cloudfront.net/artikelen/151366_1_448603_638306014132559325.png||||||||||||IngrediÃ«nten: YOGHURT, 10% muesli [HAVERVLOKKEN, suiker, zonnebloemolie, glucose-fructosestroop, TARWEVLOKKEN, kokos, HAZELNOOT, rijstebloem, TARWEMOUT, TARWEMEEL, TARWEGLUTEN, dextrose, invertsuiker, zout, GERSTEMOUT, melasse, antioxidant (tocoferolrijk extract)], suiker, 4,2% aardbei, 1,4% aardbeipuree uit concentraat, MELKEIWIT, 1,2% aardbeiensap, rijstzetmeel, verdikkingsmiddelen (pectinen, guarpitmeel), wortelconcentraat, citroensapconcentraat, natuurlijk aroma.|
87365|dirk|2025-03-27|Zuivelhoeve Boern yoghurt muesli bosvruchten|Zuivelhoeve||170|g|Home|Boodschappen|Zuivel & kaas|Yoghurt, kwark & pap|Zuivelhoeve boern yoghurt muesli bosvruchten|1.71|1.71||||||||||Home>Boodschappen>Zuivel & kaas>Yoghurt, kwark & pap>Zuivelhoeve boern yoghurt muesli bosvruchten|https://www.dirk.nl/boodschappen/zuivel-kaas/yoghurt-kwark-pap/zuivelhoeve%20boern%20yoghurt%20muesli%20bosvruchten/87365|||Yoghurt met muesli en bosvruchten.||Gekoeld bewaren (max. 7°C). Na openen beperkt houdbaar.||Bevat Gluten, Bevat Hazelnoten, Bevat Noten, Bevat Gerst, Bevat Melk(eiwit), Bevat Haver, Bevat Tarwe||Non-Organic|87365_1.PNG|https://d3r3h30p75xj6a.cloudfront.net/artikelen/151367_1_448604_638306014142592863.png|87365_2.PNG|https://d3r3h30p75xj6a.cloudfront.net/artikelen/149908_1_448604_638306014152259287.png||||||||||Ingrediënten: YOGHURT, 10% muesli [HAVERVLOKKEN, suiker, zonnebloemolie, glucose-fructosestroop, TARWEVLOKKEN, kokos, HAZELNOOT, rijstebloem, TARWEMOUT, TARWEMEEL, TARWEGLUTEN, dextrose, invertsuiker, zout, GERSTEMOUT, melasse, antioxidant (tocoferolrijk extract)], 6% bosvruchten (aardbei, braam, rode bessensap, bosbes), suiker, MELKEIWIT, maïszetmeel, verdikkingsmiddelen (guarpitmeel, pectinen), natuurlijk aroma, citroensapconcentraat, druivenconcentraat.|
91453|dirk|2025-03-27|Melkan Roomyoghurt aardbei|Melkan||1|kg|Home|Boodschappen|Zuivel & kaas|Yoghurt, kwark & pap|Melkan roomyoghurt aardbei|1.89|1.89||||||||||Home>Boodschappen>Zuivel & kaas>Yoghurt, kwark & pap>Melkan roomyoghurt aardbei|https://www.dirk.nl/boodschappen/zuivel-kaas/yoghurt-kwark-pap/melkan%20roomyoghurt%20aardbei/91453|||Volle yoghurt met aardbeibereiding||Gekoeld bewaren (max. 7°C).||Bevat Lactose, Bevat Melk(eiwit)||Non-Organic|91453_1.PNG|https://d3r3h30p75xj6a.cloudfront.net/artikelen/212909_1_449032_638727222689131288.png||||||||||||Ingrediënten :87% volle yoghurt (MELK), 13% aardbeibereiding (46% aardbei, suiker, 3% aardbeiensap uit concentraat, glucose-fructosesiroop, aroma's, wortelconcentraat, gemodificeerd maïszetmeel, verdikkingsmiddel: pectinen/guargom, stabilisator: natriumcitraten/calciumcitraten/citroenzuur).|
91454|dirk|2025-03-27|Melkan Romige yoghurt stracciatella|Melkan||1|kg|Home|Boodschappen|Zuivel & kaas|Yoghurt, kwark & pap|Melkan romige yoghurt stracciatella|1.89|1.89||||||||||Home>Boodschappen>Zuivel & kaas>Yoghurt, kwark & pap>Melkan romige yoghurt stracciatella|https://www.dirk.nl/boodschappen/zuivel-kaas/yoghurt-kwark-pap/melkan%20romige%20yoghurt%20stracciatella/91454|||Volle yoghurt met chocoladesnippersbereiding||Gekoeld bewaren (max. 7°C).||Bevat Melk(eiwit), Bevat Lactose||Non-Organic|91454_1.PNG|https://d3r3h30p75xj6a.cloudfront.net/artikelen/182963_1_449033_638439537669696867.png||||||||||||Ingrediënten :83% volle yoghurt (MELK), 17% chocoladesnippersbereiding (water, suiker, 12% chocoladesnippers (cacaomassa*, cacaoboter*, suiker), glucose-fructosestroop, gemodificeerd maïszetmeel, aroma's, verdikkingsmiddel: pectinen/guargom, stabilisator: citroenzuur/natriumcitraten/calciumcitraten). * = Rainforest Alliance gecertificeerd. Lees meer op www.ra.org.|
95641|dirk|2025-03-27|Alpro Plantaardige variatie yoghurt Grieks stijl 3.4% vet|Alpro||400|g|Home|Boodschappen|Zuivel & kaas|Yoghurt, kwark & pap|Alpro plantaardige variatie yoghurt grieks stijl 34% vet|2.19|2.19||||||||||Home>Boodschappen>Zuivel & kaas>Yoghurt, kwark & pap>Alpro plantaardige variatie yoghurt grieks stijl 34% vet|https://www.dirk.nl/boodschappen/zuivel-kaas/yoghurt-kwark-pap/alpro%20plantaardige%20variatie%20yoghurt%20grieks%20stijl%2034%25%20vet/95641|||Gefermenteerd sojaproduct met kokosroom en toegevoegde calcium en vitaminen.||Gekoeld bewaren tussen +1°C en +7°C max. Na openen: afdekken en binnen 5 dagen gebruiken||Bevat Soja, Kan sporen bevatten van Noten, Vrij van Melk(eiwit), Vrij van Gluten, Vrij van Pinda's, Vrij van Lactose||Non-Organic|95641_1.PNG|https://d3r3h30p75xj6a.cloudfront.net/artikelen/178761_1_453133_638399586455195265.png||||||||||||Ingrediënten:, SOJABASIS (93,7%) (water, gepelde SOJABONEN (11,1%)), kokosroom (1,7%), suiker, zonnebloemolie, calcium (calciumlactaat, tricalciumcitraat), stabilisator (pectinen), gemodificeerd zetmeel, zuurteregelaars (melkzuur, natriumlactaat), natuurlijke aroma's, zeezout, antioxidanten (tocoferolrijk extract, vetzuuresters van ascorbinezuur), emulgator (lecithinen), vitaminen B12, D2, yoghurtculturen / -fermenten (S. thermophilus, L. bulgaricus) Kan sporen van noten (geen pindanoten) bevatten.  Vrij van zuivel en gluten.|
95644|dirk|2025-03-27|Activia Yoghurt granen 4 stuks|Activia||500|g|Home|Boodschappen|Zuivel & kaas|Yoghurt, kwark & pap|Activia yoghurt granen 4 stuks|2.89|2.89||||||||||Home>Boodschappen>Zuivel & kaas>Yoghurt, kwark & pap>Activia yoghurt granen 4 stuks|https://www.dirk.nl/boodschappen/zuivel-kaas/yoghurt-kwark-pap/activia%20yoghurt%20granen%204%20stuks/95644|||Yoghurt met Bifidus ActiRegularis® en granen||Bewaren tussen +1°C en +6°C max. Ten minste houdbaar tot:||Bevat Gluten, Bevat Gerst, Bevat Melk(eiwit), Kan sporen bevatten van Noten, Bevat Haver, Bevat Tarwe||Non-Organic|95644_1.PNG|https://d3r3h30p75xj6a.cloudfront.net/artikelen/185083_1_453136_638458302843910808.png||||||||||||Ingrediënten: Yoghurt (MELK) met Bifidus ActiRegularis®, water, suiker, voedingsvezel (oligofructose) (2,4%), GERST (0,8%) (GLUTEN), volkoren TARWE (0,5%) (GLUTEN), zetmeel, HAVER (0,2%) (GLUTEN), natuurlijke aroma's, geconcentreerd citroensap, verdikkingsmiddel (pectinen), concentraat van MELKmineralen Kan bevatten: andere glutenbevattende granen en noten|
98969|dirk|2025-03-27|Elinas Yoghurt griekse stijl naturel 4 st|Elinas||600|g|Home|Boodschappen|Zuivel & kaas|Yoghurt, kwark & pap|Elinas yoghurt griekse stijl naturel 4 st|1.75|1.75||||||||||Home>Boodschappen>Zuivel & kaas>Yoghurt, kwark & pap>Elinas yoghurt griekse stijl naturel 4 st|https://www.dirk.nl/boodschappen/zuivel-kaas/yoghurt-kwark-pap/elinas%20yoghurt%20griekse%20stijl%20naturel%204%20st/98969|||Yoghurtproduct op Griekse wijze, 9,4% vet in het melkaandeel.||Ongeopend ten minste houdbaar tot: zie bovenkant. Gekoeld bewaren, max. 7Â°C.||Bevat Melk(eiwit), Bevat Lactose||Non-Organic|98969_1.PNG|https://d3r3h30p75xj6a.cloudfront.net/artikelen/192264_1_456680_638532804340671660.png||||||||||||Griekse stijl yoghurt 9,4% vet. Van KoeMELK|
99626|dirk|2025-03-27|Melkunie Breaker vanille|Melkunie||200|g|Home|Boodschappen|Zuivel & kaas|Yoghurt, kwark & pap|Melkunie breaker vanille|1.55|1.55||||||||||Home>Boodschappen>Zuivel & kaas>Yoghurt, kwark & pap>Melkunie breaker vanille|https://www.dirk.nl/boodschappen/zuivel-kaas/yoghurt-kwark-pap/melkunie%20breaker%20vanille/99626|||Yoghurt met vanille||Gekoeld bewaren (max 7�\x84\x83) Ten minste houdbaar tot:||Bevat Melk(eiwit)||Non-Organic|99626_1.PNG|https://d3r3h30p75xj6a.cloudfront.net/artikelen/189556_1_457014_638502636668666489.png||||||||||||Ingredienten: YOGHURT, suiker, water, gemodificeerd maïszetmeel, vanille-extract, aroma, lactase.|
100735|dirk|2025-03-27|Melkan Kokosyoghurt plantaardig 6%|Melkan||400|g|Home|Boodschappen|Zuivel & kaas|Yoghurt, kwark & pap|Melkan kokosyoghurt plantaardig 6%|1.29|1.29||||||||||Home>Boodschappen>Zuivel & kaas>Yoghurt, kwark & pap>Melkan kokosyoghurt plantaardig 6%|https://www.dirk.nl/boodschappen/zuivel-kaas/yoghurt-kwark-pap/melkan%20kokosyoghurt%20plantaardig%206%25/100735|||Gefermenteerd kokosproduct||Gekoeld bewaren (max. 7°C). Na openen beperkt houdbaar||Kan sporen bevatten van Soja, Bevat Haver||Non-Organic|100735_1.PNG|https://d3r3h30p75xj6a.cloudfront.net/artikelen/174518_1_459462_638338377459250752.png||||||||||||Ingrediënten :water, 26% kokoscrème, gemodificeerd maïszetmeel, glutenvrije HAVERVEZEL, verdikkingsmiddel: carrageen, natuurlijk aroma, zuursel. Dit product kan sporen van SOJA bevatten.|
103462|dirk|2025-03-27|Almhof Roomyoghurt framboos granaatappel|Almhof||500|g|Home|Boodschappen|Zuivel & kaas|Yoghurt, kwark & pap|Almhof roomyoghurt framboos granaatappel|2.39|2.39||||||||||Home>Boodschappen>Zuivel & kaas>Yoghurt, kwark & pap>Almhof roomyoghurt framboos granaatappel|https://www.dirk.nl/boodschappen/zuivel-kaas/yoghurt-kwark-pap/almhof%20roomyoghurt%20framboos%20granaatappel/103462|||Roomyoghurt met frambozen-granaatappel- bereiding||Gekoeld bewaren (max. 7°C). Ten minste houdbaar tot: zie deksel. Na openen beperkt houdbaar.||Bevat Melk(eiwit)||Non-Organic|103462_1.PNG|https://d3r3h30p75xj6a.cloudfront.net/artikelen/183623_1_463464_638446206334379298.png||||||||||||Ingredienten: ROOMYOGHURT, suiker, 5,4% frambozen, 1,8% granaatappelsap uit concentraat, 0,9% frambozensap uit concentraat, maïszetmeel, citroensapconcentraat, plantenconcentraten (wortel, hibiscus), natuurlijk aroma.|
104534|dirk|2025-03-27|Activia Yoghurt abrikoos|Activia||500|g|Home|Boodschappen|Zuivel & kaas|Yoghurt, kwark & pap|Activia yoghurt abrikoos|2.85|2.85||||||||||Home>Boodschappen>Zuivel & kaas>Yoghurt, kwark & pap>Activia yoghurt abrikoos|https://www.dirk.nl/boodschappen/zuivel-kaas/yoghurt-kwark-pap/activia%20yoghurt%20abrikoos/104534|||Yoghurt met Bifidus ActiRegularis® en abrikoos.||||Bevat Melk(eiwit)||Non-Organic|104534_1.PNG|https://d3r3h30p75xj6a.cloudfront.net/artikelen/184081_1_464543_638453136482526999.png||||||||||||Ingrediënten: Yoghurt (MELK) met Bifidus ActiRegularis®, abrikoos (8%), suiker, gemodificeerd zetmeel, wortelsap concentraat, verdikkingsmiddel (pectinen), MELKmineralen, natuurlijke aroma's|
107377|dirk|2025-03-27|Danio Yoghurt duo met witte chocoladestukjes|Danio||103|g|Home|Boodschappen|Zuivel & kaas|Yoghurt, kwark & pap|Danio yoghurt duo met witte chocoladestukjes|0.95|0.95||||||||||Home>Boodschappen>Zuivel & kaas>Yoghurt, kwark & pap>Danio yoghurt duo met witte chocoladestukjes|https://www.dirk.nl/boodschappen/zuivel-kaas/yoghurt-kwark-pap/danio%20yoghurt%20duo%20met%20witte%20chocoladestukjes/107377|||Yoghurt met Witte Chocoladestukjes||Ten minste houdbaar tot: zie deksel. Bewaren bij +6C max.||Kan sporen bevatten van Gluten, Kan sporen bevatten van Ei, Bevat Melk(eiwit), Kan sporen bevatten van Noten, Kan sporen bevatten van Pinda's, Bevat Soja||Non-Organic|107377_1.PNG|https://d3r3h30p75xj6a.cloudfront.net/artikelen/185704_1_464116_638485131448857979.png||||||||||||Ingrediënten:  Yoghurt: magere MELK, room (MELK), suiker, magere MELKpoeder, MELKfermenten., Witte chocolade stukjes 11,7%: suiker, cacaoboter, volle MELKpoeder, weipoeder (MELK), yoghurtpoeder (MELK), emulgator (SOJAlecithine), aroma. Kan bevatten: andere gluten bevattende granen, ei, noten en pinda.|
107907|dirk|2025-03-27|Melkunie Breaker appeltaart|Melkunie||200|g|Home|Boodschappen|Zuivel & kaas|Yoghurt, kwark & pap|Melkunie breaker appeltaart|1.65|1.65||||||||||Home>Boodschappen>Zuivel & kaas>Yoghurt, kwark & pap>Melkunie breaker appeltaart|https://www.dirk.nl/boodschappen/zuivel-kaas/yoghurt-kwark-pap/melkunie%20breaker%20appeltaart/107907|||Yoghurt met appel en gemalen koekjes||Gekoeld bewaren op max. 7 °C. Ten minste houdbaar tot:||Bevat Melk(eiwit)||Non-Organic|107907_1.PNG|https://d3r3h30p75xj6a.cloudfront.net/artikelen/189575_1_465806_638512002399397561.png||||||||||||YOGHURT (3,6% vet), suiker, 6% appel, gemodificeerd maïszetmeel, 0,5% gemalen koekjes (maïsmeel, suiker, BOTER, rijstmeel, zout), natuurlijk aroma, verdikkingsmiddel: pectine, kaneel, aroma, lactase|
111182|dirk|2025-03-27|Oddlygood Dreamy berries|Oddlygood||130|g|Home|Boodschappen|Zuivel & kaas|Yoghurt, kwark & pap|Oddlygood dreamy berries|1.79|1.79||||||||||Home>Boodschappen>Zuivel & kaas>Yoghurt, kwark & pap>Oddlygood dreamy berries|https://www.dirk.nl/boodschappen/zuivel-kaas/yoghurt-kwark-pap/oddlygood%20dreamy%20berries/111182|||Gefermenteerd dessert op basis van haver met frambozen en blauwe bessen, verrijkt met vitamines en mineralen||Gekoeld bewaren tussen +2 °C en +8 °C||Bevat Haver, Vrij van Gluten||Non-Organic|111182_1.PNG|https://d3r3h30p75xj6a.cloudfront.net/artikelen/197516_1_470374_638636340345972582.png||||||||||||Ingrediënten: water, suiker, geheel geharde kokosolie, glutenvrije HAVERMEEL (4%), frambozen (3%), favaboneneiwit, plantaardige oliën (koolzaad, raapzaad), blauwe bessen (2%), blauwe bessen en vossenbessensap uit concentraat (1%), gemodificeerd zetmeel, aroma's, emulgator (E472e), calcium, zout, zuurteregelaar (natriumcitraten), vitamines (riboflavine (B2), B12, D2), jodium, startercultuur, Lactobacillus acidophilus, Bifidobacterium sp.|
