unique_id|competitor_name|extraction_date|product_name|brand|brand_type|grammage_quantity|grammage_unit|producthierarchy_level1|producthierarchy_level2|producthierarchy_level3|producthierarchy_level4|producthierarchy_level5|regular_price|selling_price|price_was|promotion_price|promotion_valid_from|promotion_valid_upto|promotion_type|percentage_discount|promotion_description|price_per_unit|currency|breadcrumb|pdp_url|fat_%|variants|product_description|instructions|storage_instructions|country_of_origin|allergens|nutritional_score|organictype|file_name_1|image_url_1|file_name_2|image_url_2|file_name_3|image_url_3|file_name_4|image_url_4|file_name_5|image_url_5|file_name_6|image_url_6|upc|ingredients|servings_per_pack
84137|dirk|2025-03-27|Melkan Demi creme fraiche|Melkan||125|g|Home|Boodschappen|Zuivel & kaas|Slagroom & kookroom|Melkan demi creme fraiche|0.89|0.89||||||||||Home>Boodschappen>Zuivel & kaas>Slagroom & kookroom>Melkan demi creme fraiche|https://www.dirk.nl/boodschappen/zuivel-kaas/slagroom-kookroom/melkan%20demi%20creme%20fraiche/84137|||Demi crème fraîche 15% vet||Gekoeld bewaren (max. 7°C).||Bevat Melk(eiwit), Bevat Lactose||Non-Organic|84137_1.PNG|https://d3r3h30p75xj6a.cloudfront.net/artikelen/206741_1_445472_638682111510906159.png||||||||||||Ingrediënten :MELK, room (MELK).|
84215|dirk|2025-03-27|Melkan Zure room|Melkan||125|g|Home|Boodschappen|Zuivel & kaas|Slagroom & kookroom|Melkan zure room|0.56|0.56||||||||||Home>Boodschappen>Zuivel & kaas>Slagroom & kookroom>Melkan zure room|https://www.dirk.nl/boodschappen/zuivel-kaas/slagroom-kookroom/melkan%20zure%20room/84215|||Zure room 10% vet||Gekoeld bewaren (max. 7°C).||Bevat Melk(eiwit), Bevat Lactose||Non-Organic|84215_1.PNG|https://d3r3h30p75xj6a.cloudfront.net/artikelen/206740_1_445469_638682111495791274.png||||||||||||Ingrediënten :Zure room (MELK).|
101056|dirk|2025-03-27|Melkan Creme fraiche haver plantaardig|Melkan||125|g|Home|Boodschappen|Zuivel & kaas|Slagroom & kookroom|Melkan creme fraiche haver plantaardig|0.61|0.61||||||||||Home>Boodschappen>Zuivel & kaas>Slagroom & kookroom>Melkan creme fraiche haver plantaardig|https://www.dirk.nl/boodschappen/zuivel-kaas/slagroom-kookroom/melkan%20creme%20fraiche%20haver%20plantaardig/101056|||Plantaardig gefermenteerd kookproduct op haverbasis||Gekoeld bewaren (max. 7°C). Na openen beperkt houdbaar||Kan sporen bevatten van Gluten, Kan sporen bevatten van Tarwe, Bevat Haver||Non-Organic|101056_1.PNG|https://d3r3h30p75xj6a.cloudfront.net/artikelen/183037_1_459464_638439555823602547.png||||||||||||Ingrediënten :Water, 8% glutenvrije HAVER, raapzaadolie, kokosolie, aardappelzetmeel, gemodificeerd maïszetmeel, aardappeleiwit, zuurteregelaar: E334/E296/E330, natuurlijk aroma, zout, culturen. Dit product kan sporen van GLUTENBEVATTENDE GRANEN bevatten.|
103409|dirk|2025-03-27|Melkan Plantaardige kookroom soja|Melkan||200|ml|Home|Boodschappen|Zuivel & kaas|Slagroom & kookroom|Melkan plantaardige kookroom soja|0.99|0.99||||||||||Home>Boodschappen>Zuivel & kaas>Slagroom & kookroom>Melkan plantaardige kookroom soja|https://www.dirk.nl/boodschappen/zuivel-kaas/slagroom-kookroom/melkan%20plantaardige%20kookroom%20soja/103409|||UHT kookproduct op basis van soja|schudden voor gebruik|Koel en droog bewaren.||Bevat Soja||Non-Organic|103409_1.PNG|https://d3r3h30p75xj6a.cloudfront.net/artikelen/200021_1_461673_638616675074210257.png||||||||||||Ingrediënten :water, koolzaadolie, 5% SOJABONEN, suiker, emulgator: SOJALECITHINE, stabilisator: E415/E407, zout, aroma.|
110170|dirk|2025-03-27|Blue Band Alternatief kookroom vegan finesse plant|Blue Band||250|ml|Home|Boodschappen|Zuivel & kaas|Slagroom & kookroom|Blue band alternatief kookroom vegan finesse plant|1.59|1.59||||||||||Home>Boodschappen>Zuivel & kaas>Slagroom & kookroom>Blue band alternatief kookroom vegan finesse plant|https://www.dirk.nl/boodschappen/zuivel-kaas/slagroom-kookroom/blue%20band%20alternatief%20kookroom%20vegan%20finesse%20plant/110170|||Product met linzenproteïne en plantaardige oliën||Gekoeld bewaren (2-7ºC) Na opening, binnen 3 dagen gebruiken.||Vrij van Lactose, Vrij van Melk(eiwit), Vrij van Gluten||Non-Organic|110170_1.PNG|https://d3r3h30p75xj6a.cloudfront.net/artikelen/202205_1_469137_638640897840344942.png||||||||||||Ingrediënten: bereiding van linzenproteïne (water, 1.1% linzenproteine), kokosolie, koolzaadolie, maïszetmeel, suiker, zout, natuurlijke aroma's, vitamine B12.|
5688|dirk|2025-03-27|Melkunie Slagroom kant en klaar|Melkunie||500|ml|Home|Boodschappen|Zuivel & kaas|Slagroom & kookroom|Melkunie slagroom kant en klaar|2.25|2.25||||||||||Home>Boodschappen>Zuivel & kaas>Slagroom & kookroom>Melkunie slagroom kant en klaar|https://www.dirk.nl/boodschappen/zuivel-kaas/slagroom-kookroom/melkunie%20slagroom%20kant%20en%20klaar/5688|||Opgeklopte slagroom met suiker, gepasteuriseerd|Tip: doe de slagroom in een spuitzak en maak zo mooie toefen op een taart. Ook heerlijk op de chocoladevla.|Ten minste houdbaar tot: zie datum bovenzijde. Gekoeld bewaren (max. 7°C).||Vrij van Gluten, Vrij van Schaaldieren, Vrij van Ei, Vrij van Lupine, Bevat Melk(eiwit), Vrij van Mosterd, Vrij van Noten, Vrij van Pinda's, Vrij van Selderij, Vrij van Sesam(zaad), Vrij van Soja, Vrij van Zwaveldioxide en sulfieten, Vrij van Vis, Vrij van Weekdieren, Vrij van Schelpdieren||Non-Organic|5688_1.PNG|https://d3r3h30p75xj6a.cloudfront.net/artikelen/116321_1_338248_637880589663613247.png||||||||||||Ingrediënten: SlagROOM, 9% suiker, gelatine|
20513|dirk|2025-03-27|Melkan Verse slagroom 35% vet|Melkan||500|ml|Home|Boodschappen|Zuivel & kaas|Slagroom & kookroom|Melkan verse slagroom 35% vet|2.49|2.49||||||||||Home>Boodschappen>Zuivel & kaas>Slagroom & kookroom>Melkan verse slagroom 35% vet|https://www.dirk.nl/boodschappen/zuivel-kaas/slagroom-kookroom/melkan%20verse%20slagroom%2035%25%20vet/20513|||slagroom 35% vet|klop 500ml slagroom op met 4 afgestreken eetlepels suiker tot de gewenste dikte Goed koelen voor gebruik. Niet invriezen. Let op: Voor het eerste gebruik de verzegeling van het spuitmondje verbreken door het drukvlak even naar boven te drukken. Voor gebruik even goed schudden met de bus. Keer de bus volledig om, druk het drukvlakje in en spuit met een licht draaibeweging. Na gebruik, de spuitkop via de bovenzijde grondig uitspoelen met warm water en de bus terug in de koelkast plaatsen. Na openen gekoeld bewaren (max. 7°C). Houder onder druk: kan openbarsten bij verhitting. Verwijderd houden van warmte, hete oppervlakken, vonken, open vuur en andere ontstekingsbronnen. Niet roken, Ook na gebruik niet doorboren of verbranden. Tegen zonlicht beschermen. Niet blootstellen aan temperaturen boven 50°C/122°F.|Gekoeld bewaren (max. 7°C). Na openen beperkt houdbaar||Bevat Melk(eiwit), Bevat Lactose||Non-Organic|20513_1.PNG|https://d3r3h30p75xj6a.cloudfront.net/artikelen/114250_1_377410_637867386438871640.png||||||||||||Ingrediënten :room(35% vet) (MELK), stabilisator: E407|
55355|dirk|2025-03-27|Melkan Geslagen room spuitbus|Melkan||250|g|Home|Boodschappen|Zuivel & kaas|Slagroom & kookroom|Melkan geslagen room spuitbus|1.85|1.85||||||||||Home>Boodschappen>Zuivel & kaas>Slagroom & kookroom>Melkan geslagen room spuitbus|https://www.dirk.nl/boodschappen/zuivel-kaas/slagroom-kookroom/melkan%20geslagen%20room%20spuitbus/55355|||Gesuikerde room in spuitbus, UHT|Gebruiksaanwijzing: - Voor gebruik goed koelen Verzegeling verbreken door de spuitmond naar boven te drukken - Voor gebruik goed schudden - Tijdens het spuiten de bus volledig omgekeerd houden - Na gebruik de spuitmond goed reinigen met warm water, en de bus in de koelkast bewaren Voor gebruik goed koelen. Verzegeling verbreken door de spuitmond naar boven te drukken. Voor gebruik goed schudden. Tijdens het spuiten de bus volledig omgekeerd houden. Na gebruik de spuitmond goed reinigen met warm water en de bus in de koelkast bewaren.|Gekoeld bewaren (max. 7°C).||Bevat Melk(eiwit), Bevat Lactose||Non-Organic|55355_1.PNG|https://d3r3h30p75xj6a.cloudfront.net/artikelen/116282_1_408562_637880589705069470.png||||||||||||Ingrediënten :91% room (21% vet) (MELK), 9% suiker, emulgator: E471/E472b, stabilisator: E407, natuurlijk vanillearoma, drijfgas: E942.|
74586|dirk|2025-03-27|Melkan Slagroom 35% vet|Melkan||250|ml|Home|Boodschappen|Zuivel & kaas|Slagroom & kookroom|Melkan slagroom 35% vet|1.29|1.29||||||||||Home>Boodschappen>Zuivel & kaas>Slagroom & kookroom>Melkan slagroom 35% vet|https://www.dirk.nl/boodschappen/zuivel-kaas/slagroom-kookroom/melkan%20slagroom%2035%25%20vet/74586|||Slagroom, 35% vet|direct uit de koelkast in een kom opkloppen. eventuele suiker pas toevoegen als de room dik vloeibaar is.|Gekoeld bewaren (max. 7°C). Na openen beperkt houdbaar||Bevat Melk(eiwit), Bevat Lactose||Non-Organic|74586_1.PNG|https://d3r3h30p75xj6a.cloudfront.net/artikelen/125053_1_430772_638236261953440973.png||||||||||||Ingrediënten :slagroom (35% vet) (MELK), stabilisator: E407|
103424|dirk|2025-03-27|Melkan Weidemelk slagroom luxe|Melkan||250|g|Home|Boodschappen|Zuivel & kaas|Slagroom & kookroom|Melkan weidemelk slagroom luxe|1.85|1.85||||||||||Home>Boodschappen>Zuivel & kaas>Slagroom & kookroom>Melkan weidemelk slagroom luxe|https://www.dirk.nl/boodschappen/zuivel-kaas/slagroom-kookroom/melkan%20weidemelk%20slagroom%20luxe/103424|||Gesuikerde slagroom in spuitbus, UHT|Gebruiksaanwijzing: - Bijvoorkeur gekoeld bewaren Verzegeling verbreken door de spuitmond naar boven te drukken - Voor gebruik goed schudden - Tijdens het spuiten de bus volledig omgekeerd houden - Na gebruik de spuitmond goed reinigen met warm water, en de bus in de koelkast bewaren Gebruiksaanwijzing: voor gebruik goed koelen. Voor het eerste gebruik de verzegeling verbreken door de spuitmond naar boven te drukken. Voor gebruik goed schudden. Bij gebruik de bus volledig omgekeerd houden, garneren en direct serveren. Spuitmond en ventiel na gebruik goed afspoelen met warm water en de bus in de koelkast bewaren. Waarschuwing: houder onder druk: kan openbarsten bij verhitting. Verwijderd houden van warmte, hete oppervlakken, vonken, open vuur en andere ontstekingsbronnen. Niet roken. Ook na gebruik niet doorboren of verbranden.|Na openen gekoeld bewaren (max. 7°C).||Bevat Melk(eiwit), Bevat Lactose||Non-Organic|103424_1.PNG|https://d3r3h30p75xj6a.cloudfront.net/artikelen/186979_1_462712_638477337953613961.png||||||||||||Ingrediënten :90% room (36% vet) (MELK), 10% suiker, emulgator: E471, stabilisator: E407, drijfgas: E942.|
58379|dirk|2025-03-27|Melkunie Chocolade pudding protein|Melkunie||200|g|Home|Boodschappen|Zuivel & kaas|Toetjes|Melkunie chocolade pudding protein|1.69|0.99|0.99|0.99|||||Geldig van dinsdag 25 maart t/m dinsdag 1 april 2025|||Home>Boodschappen>Zuivel & kaas>Toetjes>Melkunie chocolade pudding protein|https://www.dirk.nl/boodschappen/zuivel-kaas/toetjes/melkunie%20chocolade%20pudding%20protein/58379|||Pudding met chocoladesmaak met zoetstoffen en toegevoegd Magnesium en Vitamine D, Gesteriliseerd.|Gekoeld het lekkerst!|Na openen gekoeld bewaren (max. 7°C) en beperkt houdbaar. Ten minste houdbaar tot: zie datum bovenzijde.||Bevat Melk(eiwit)||Non-Organic|58379_1.PNG|https://d3r3h30p75xj6a.cloudfront.net/artikelen/178027_1_411213_638386803635435437.png||||||||||||Ingrediënten: MELK, MELKeiwitten zoetstoffen: erytritol en steviolglycosiden uit Stevia, 1,8% magere cacaopoeder, stabilisatoren: carrageen en guarpitmeel, BCAA: leucine, isoleucine en valine, natuurlijk aroma , magnesiumcarbonaat, vitamine D3, lactase.|
58380|dirk|2025-03-27|Melkunie Caramel pudding protein|Melkunie||200|g|Home|Boodschappen|Zuivel & kaas|Toetjes|Melkunie caramel pudding protein|1.69|0.99|0.99|0.99|||||Geldig van dinsdag 25 maart t/m dinsdag 1 april 2025|||Home>Boodschappen>Zuivel & kaas>Toetjes>Melkunie caramel pudding protein|https://www.dirk.nl/boodschappen/zuivel-kaas/toetjes/melkunie%20caramel%20pudding%20protein/58380|||Gezouten Karamelpudding met zoetstoffen en toegevoegd magnesium, vitamine D, gesteriliseerd||Na openen gekoeld bewaren (max. 7°C) en beperkt houdbaar. Ten minste houdbaar tot: zie datum bovenzijde.||Bevat Melk(eiwit)||Non-Organic|58380_1.PNG|https://d3r3h30p75xj6a.cloudfront.net/artikelen/178888_1_411214_638399694409120228.png||||||||||||Ingrediënten: MELK, MELKeiwit, zoetstoffen: erytritol en steviolglycosiden, stabilisatoren: carrageen en guargom, zout, BCAA: leucine, isoleucine en valine, natuurlijk aroma, magnesiumcarbonaat, vitamine D3, lactase|
36587|dirk|2025-03-27|Ehrmann Grand dessert griess|Ehrmann||190|g|Home|Boodschappen|Zuivel & kaas|Toetjes|Ehrmann grand dessert griess|1.09|0.59|0.59|0.59|||||Geldig van dinsdag 25 maart t/m dinsdag 1 april 2025|||Home>Boodschappen>Zuivel & kaas>Toetjes>Ehrmann grand dessert griess|https://www.dirk.nl/boodschappen/zuivel-kaas/toetjes/ehrmann%20grand%20dessert%20griess/36587|||Griesmeel dessert met room.||Gekoeld bewaren (max +7°C) ten minste houdbaar tot: zie deksel.||Bevat Melk(eiwit), Bevat Lactose, Bevat Gluten, Kan sporen bevatten van Soja, Bevat Tarwe||Non-Organic|36587_1.PNG|https://d3r3h30p75xj6a.cloudfront.net/artikelen/209489_1_391148_638701254916697738.png|36587_2.PNG|https://d3r3h30p75xj6a.cloudfront.net/artikelen/215123_1_391148_638742570755118717.png||||||||||Ingrediënten: volle MELK, ROOM 20%, suiker, glucose-fructosesiroop, gehard TARWE griesmeel 4,3%, gemodificeerd zetmeel, gelatine (rund), verdikkingsmiddelen (carrageen, guarpitmeel), emulgator (E 472b), aroma, zout, kleurstof (carotenen). Roomtopping opgeklopt met stikstof. Kan sporen van soja bevatten.|
36752|dirk|2025-03-27|Ehrmann Grand dessert chocolade|Ehrmann||190|g|Home|Boodschappen|Zuivel & kaas|Toetjes|Ehrmann grand dessert chocolade|1.09|0.59|0.59|0.59|||||Geldig van dinsdag 25 maart t/m dinsdag 1 april 2025|||Home>Boodschappen>Zuivel & kaas>Toetjes>Ehrmann grand dessert chocolade|https://www.dirk.nl/boodschappen/zuivel-kaas/toetjes/ehrmann%20grand%20dessert%20chocolade/36752|||Dessert met room.||Gekoeld bewaren (max +7°C) ten minste houdbaar tot: zie deksel.||Bevat Melk(eiwit), Bevat Lactose||Non-Organic|36752_1.PNG|https://d3r3h30p75xj6a.cloudfront.net/artikelen/209490_1_391263_638701257399610365.png|36752_2.PNG|https://d3r3h30p75xj6a.cloudfront.net/artikelen/215124_1_391263_638741694586055292.png||||||||||Ingrediënten: magere MELK, ROOM 20%, vloeibare MELKBESTANDDELEN, glucose-fructosesiroop, suiker, gemodificeerd zetmeel, chocolade 1,0% (suiker, cacaopoeder, cacaoboter), magere cacaopoeder 1,0%, gelatine (rund), verdikkingsmiddelen (carrageen, guarpitmeel), emulgator (E 472b), aroma. Roomtopping opgeklopt met stikstof.|
36753|dirk|2025-03-27|Ehrmann Grand dessert double toffee|Ehrmann||190|g|Home|Boodschappen|Zuivel & kaas|Toetjes|Ehrmann grand dessert double toffee|1.09|0.59|0.59|0.59|||||Geldig van dinsdag 25 maart t/m dinsdag 1 april 2025|||Home>Boodschappen>Zuivel & kaas>Toetjes>Ehrmann grand dessert double toffee|https://www.dirk.nl/boodschappen/zuivel-kaas/toetjes/ehrmann%20grand%20dessert%20double%20toffee/36753|||Dessert met room.||Gekoeld bewaren (max +7°C) ten minste houdbaar tot: zie deksel.||Bevat Melk(eiwit), Bevat Lactose||Non-Organic|36753_1.PNG|https://d3r3h30p75xj6a.cloudfront.net/artikelen/215125_1_391264_638741685551028446.png||||||||||||Ingrediënten: Ingrediënten: magere MELK, ROOM 20%, vloeibare MELKBESTANDDELEN, suiker, gemodificeerd zetmeel, glucose-fructosesiroop, karamelsuikersiroop, caramel creme (suiker, water, magere MELK poeder, glucosesiroop), verdikkingsmiddelen (carrageen, guarpitmeel), gelatine (rund), aroma, emulgator (E 472b), volle MELK poeder, zout, kleurstof (carotenen). Roomtopping opgeklopt met stikstof.|
36780|dirk|2025-03-27|Ehrmann Grand dessert vanille met slagroom|Ehrmann||190|g|Home|Boodschappen|Zuivel & kaas|Toetjes|Ehrmann grand dessert vanille met slagroom|1.09|0.59|0.59|0.59|||||Geldig van dinsdag 25 maart t/m dinsdag 1 april 2025|||Home>Boodschappen>Zuivel & kaas>Toetjes>Ehrmann grand dessert vanille met slagroom|https://www.dirk.nl/boodschappen/zuivel-kaas/toetjes/ehrmann%20grand%20dessert%20vanille%20met%20slagroom/36780|||Dessert met room.||Gekoeld bewaren (max +7°C) ten minste houdbaar tot: zie deksel.||Bevat Melk(eiwit), Bevat Lactose||Non-Organic|36780_1.PNG|https://d3r3h30p75xj6a.cloudfront.net/artikelen/217175_1_391265_638751441187476218.png||||||||||||Ingrediënten: magere MELK, ROOM 20%, vloeibare MELKBESTANDDELEN, glucose-fructosesiroop, suiker, gemodificeerd zetmeel, verdikkingsmiddelen (carageen, guarpitmeel), gelatine (rund), natuurlijke bourbon vanille aroma, geëxtraheerde vanillestokjes, emulgator (E 472b), zout, kleurstof (carotenen). Roomtopping opgeklopt met stikstof.|
20223|dirk|2025-03-27|Danio Luchtige kwark aardbei vanille|Danio||2|x|Home|Boodschappen|Zuivel & kaas|Yoghurt, kwark & pap|Danio luchtige kwark aardbei vanille|1.65|1.29|1.29|1.29|2025-03-26|2025-04-01|||Geldig van dinsdag 25 maart t/m maandag 31 maart 2025|||Home>Boodschappen>Zuivel & kaas>Yoghurt, kwark & pap>Danio luchtige kwark aardbei vanille|https://www.dirk.nl/boodschappen/zuivel-kaas/yoghurt-kwark-pap/danio%20luchtige%20kwark%20aardbei%20vanille/20223|||Luchtig Zuivelproduct met Kwark, Aardbei en Vanillesmaak||Bewaren bij +6°C max. Ten minste houdbaar tot.||Bevat Melk(eiwit)||Non-Organic|20223_1.PNG|https://d3r3h30p75xj6a.cloudfront.net/artikelen/105789_1_408970_638040240088703522.png||||||||||||Magere MELK, magere kwark (MELK) (28,5%), room (MELK), suiker, aardbei (7%), glucose-fructosestroop, gemodificeerd maïszetmeel, varkensgelatine, zwarte bessensap, verdikkingsmiddelen (pectinen, guarpitmeel, johannesbroodpitmeel), kleurstoffen (karmijn, carotenen), zuurteregelaars (natriumcitraten, citroenzuur), aroma's, MELKfermenten, Bevat: MELK.|
1204|dirk|2025-03-27|Bessola Krentjebrij|Bessola||1|liter|Home|Boodschappen|Zuivel & kaas|Toetjes|Bessola krentjebrij|1.65|1.65||||||||||Home>Boodschappen>Zuivel & kaas>Toetjes>Bessola krentjebrij|https://www.dirk.nl/boodschappen/zuivel-kaas/toetjes/bessola%20krentjebrij/1204|||Krentjebrij||Ten minste houdbaar tot: zie bovenzijde verpakking Na openen gekoeld bewaren (max. 7°C)||Bevat Gerst||Non-Organic|1204_1.PNG|https://d3r3h30p75xj6a.cloudfront.net/artikelen/181310_1_140088_638424657701876755.png||||||||||||Water, suiker, rozijnen 4.9%, gort (GERST) 4.5%, bessensap 3.1%, krenten 2.0%, zuurteregelaar: citroenzuur, kleurstof: karmijnzuur, conserveermiddel: sorbinezuur, aroma, kaneel <0,1%|
9139|dirk|2025-03-27|Bauer Roomyoghurt vruchten|Bauer||150|ml|Home|Boodschappen|Zuivel & kaas|Toetjes|Bauer roomyoghurt vruchten|0.48|0.48||||||||||Home>Boodschappen>Zuivel & kaas>Toetjes>Bauer roomyoghurt vruchten|https://www.dirk.nl/boodschappen/zuivel-kaas/toetjes/bauer%20roomyoghurt%20vruchten/9139|||Vetarme milde yoghurt met 7% vruchtenbereiding (aardbei)||Bij kamertemperatuur bewaren (max. 25°C). Ten minste houdbaar tot: Zie deksel||Bevat Melk(eiwit)||Non-Organic|9139_1.PNG|https://d3r3h30p75xj6a.cloudfront.net/artikelen/1646_1_40938_638306012443580968.png|9139_2.PNG|https://d3r3h30p75xj6a.cloudfront.net/artikelen/83127_1_40938_638306012452807755.png||||||||||Ingrediënten: magere yoghurt, suiker, water, gemodificeerd maïszetmeel, aardbeien (2,1%), aardbeipuree (0,9%), aroma, kleurstof (karmijn), kleurend plantenconcentraat (wortel), zuurteregelaar (citroenzuur), verdikkingsmiddel (pectine).|
52840|dirk|2025-03-27|Alpro Sojadessert vanille|Alpro||525|ml|Home|Boodschappen|Zuivel & kaas|Toetjes|Alpro sojadessert vanille|1.83|1.83||||||||||Home>Boodschappen>Zuivel & kaas>Toetjes>Alpro sojadessert vanille|https://www.dirk.nl/boodschappen/zuivel-kaas/toetjes/alpro%20sojadessert%20vanille/52840|||Sojadessert, vanillesmaak, met toegevoegde calcium en vitaminen.||Ten minste houdbaar tot: zie bovenkant. - Na openen 5 dagen houdbaar in de koelkast (max. 7°C).||Vrij van Gluten, Vrij van Melk(eiwit), Bevat Soja, Vrij van Lactose||Non-Organic|52840_1.PNG|https://d3r3h30p75xj6a.cloudfront.net/artikelen/199975_1_405852_638616667005681480.png||||||||||||INGREDI�NTEN: SOJABASIS (water, gepelde SOJABONEN (8,1%)), suiker, gemodificeerd zetmeel, cichoreivezel, tricalciumfosfaat, aroma's, zeezout, verdikkingsmiddel (carrageen), kurkumaextract, vitaminen (B2, B12, D2). Vrij van zuivel en gluten. Van nature lactosevrij.|
583|dirk|2025-03-27|Dr. Oetker Paula vla vanille en chocolade|Dr. Oetker||125|g|Home|Boodschappen|Zuivel & kaas|Toetjes|Dr oetker paula vla vanille en chocolade|2.49|2.49||||||||||Home>Boodschappen>Zuivel & kaas>Toetjes>Dr oetker paula vla vanille en chocolade|https://www.dirk.nl/boodschappen/zuivel-kaas/toetjes/dr%20oetker%20paula%20vla%20vanille%20en%20chocolade/583|||Vla met vanillesmaak met 30% choco-vla||bij max. +7°C ten minste houdbaar tot:||Bevat Melk(eiwit)||Non-Organic|583_1.PNG|https://d3r3h30p75xj6a.cloudfront.net/artikelen/550_1_127299_637176285285278150.png||||||||||||Ingrediënten: 85% volle MELK, suiker, 3,7% magere MELK, gemodificeerd zetmeel (tapioca), 0,6% magere cacao, MELKEIWITPRODUCT, aroma, verdikkingsmiddel (carrageen), kleurstof (carotenen), stabilisator (natriumcarbonaten).|
5135|dirk|2025-03-27|Danoontje Kinder Fruitkwark Toetjes Banaan, Aardbei & Abrikoos|Danoontje||6|x|Home|Boodschappen|Zuivel & kaas|Toetjes|Danoontje kinder fruitkwark toetjes banaan, aardbei & abrikoos|1.55|1.55||||||||||Home>Boodschappen>Zuivel & kaas>Toetjes>Danoontje kinder fruitkwark toetjes banaan, aardbei & abrikoos|https://www.dirk.nl/boodschappen/zuivel-kaas/toetjes/danoontje%20kinder%20fruitkwark%20toetjes%20banaan%2c%20aardbei%20%26%20abrikoos/5135|||Kwark met fruit verrijkt met calcium en vitamine D. Danoontje Fruitkwark Banaan Aardbei Abrikoos van Danone bevat 6 kindertoetjes in drie verschillende smaken. Valt gegarandeerd in de smaak en is ook geschikt als tussendoortje of traktatie!<br><br>Tip! Steek een ijsstokje door de cups en doe ze vervolgens in de vriezer tot de kwark bevroren is. Zo maak je heerlijke Danoontje ijsjes!||Bewaren bij 1ºC - 6ºC||Bevat Melk(eiwit), Kan sporen bevatten van Noten||Non-Organic|5135_1.PNG|https://d3r3h30p75xj6a.cloudfront.net/artikelen/113501_1_331162_638048916778159913.png||||||||||||Ingrediënten:Kwark (80%) (MELK),water, fruit (5,6%) (aardbei, abrikoos, banaan), suiker 1,5%, verdikkingsmiddelen (gemodificeerd maïszetmeel, guargom), geconcentreerd citroensap, mineraal (calciumcitraat), MELKeiwitten, aromas, natuurlijke aroma's, zwarte wortelconcentraat, vitamine D.|
5136|dirk|2025-03-27|Danoontje Kinder Fruitkwark Toetjes Aardbei Abrikoos|Danoontje||4|x|Home|Boodschappen|Zuivel & kaas|Toetjes|Danoontje kinder fruitkwark toetjes aardbei abrikoos|2.19|2.19||||||||||Home>Boodschappen>Zuivel & kaas>Toetjes>Danoontje kinder fruitkwark toetjes aardbei abrikoos|https://www.dirk.nl/boodschappen/zuivel-kaas/toetjes/danoontje%20kinder%20fruitkwark%20toetjes%20aardbei%20abrikoos/5136|||Kwark met fruit, verrijkt met calcium en vitamine D. Danoontje Fruitkwark Aardbei Abrikoos van Danone bevat 4 heerlijke kindertoetjes in twee verschillende smaken. Valt gegarandeerd in de smaak en is ook geschikt als tussendoortje of traktatie!<br><br>Tip! Steek een ijsstokje door de cups en doe ze vervolgens in de vriezer tot de kwark bevroren is. Zo maak je heerlijke Danoontje ijsjes!||Bewaren bij +1° C +6° C||Bevat Melk(eiwit), Kan sporen bevatten van Noten||Non-Organic|5136_1.PNG|https://d3r3h30p75xj6a.cloudfront.net/artikelen/113502_1_331165_638237151317554324.png||||||||||||Ingrediënten:Kwark (80%) (MELK), water, fruit (5,6%) (aardbei, abrikoos), suiker (5%), verdikkingsmiddelen (gemodificeerd maïszetmeel, guargom), geconcentreerd citroensap, mineraal (calciumcitraat), MELKeiwitten, natuurlijk aroma, aroma's, zwarte wortelconcentraat, vitamine D.|
5969|dirk|2025-03-27|Dr. Oetker Paula mini vanille met choco vlekken|Dr. Oetker||300|g|Home|Boodschappen|Zuivel & kaas|Toetjes|Dr oetker paula mini vanille met choco vlekken|1.79|1.79||||||||||Home>Boodschappen>Zuivel & kaas>Toetjes>Dr oetker paula mini vanille met choco vlekken|https://www.dirk.nl/boodschappen/zuivel-kaas/toetjes/dr%20oetker%20paula%20mini%20vanille%20met%20choco%20vlekken/5969|||Vla/ pudding met vanillesmaak met 30% chocovla/ chocopudding||Bij max. 7°C ten minste houdbaar en tot:||Bevat Melk(eiwit)||Non-Organic|5969_1.PNG|https://d3r3h30p75xj6a.cloudfront.net/artikelen/1080_1_341119_637807059695609142.png||||||||||||Ingrediënten: 85% volle MELK , suiker, 3,7% magere MELK, gemodificeerd zetmeel (tapioca), 0,6% magere cacao, MELKEIWITPRODUCT, aroma, verdikkingsmiddel (carrageen), kleurstof (carotenen), stabilisator (natriumcarbonaten).|
